{
  "$schema": "https://json-schema.org/draft/2020-12/schema",
  "$id": "urn:srcos:agent-machine:schema:agent-registry-grant:v0.1.0",
  "title": "AgentRegistryGrant",
  "description": "Secret-free Agent Registry grant/stub for Agent Machine activation, provider access, tool scope, cache scope, memory scope, and storage/evidence scope.",
  "type": "object",
  "additionalProperties": false,
  "required": [
    "specVersion",
    "id",
    "kind",
    "request",
    "grant",
    "scope",
    "receiptSafety",
    "issuedAt"
  ],
  "properties": {
    "specVersion": { "type": "string", "const": "0.1.0" },
    "id": {
      "type": "string",
      "pattern": "^urn:srcos:agent-machine:agent-registry-grant:[a-z0-9][a-z0-9-]*$"
    },
    "kind": { "type": "string", "const": "AgentRegistryGrant" },
    "request": {
      "type": "object",
      "additionalProperties": false,
      "required": ["requestId", "agentPodId", "requestedAgentIdentityRef", "sessionRef"],
      "properties": {
        "requestId": { "type": "string" },
        "agentMachineId": {
          "type": ["string", "null"],
          "pattern": "^urn:srcos:agent-machine:[a-z0-9][a-z0-9-]*$"
        },
        "agentPodId": {
          "type": "string",
          "pattern": "^urn:srcos:agent-machine:agent-pod:[a-z0-9][a-z0-9-]*$"
        },
        "requestedAgentIdentityRef": { "type": "string" },
        "sessionRef": { "type": "string" },
        "workroomRef": { "type": ["string", "null"] },
        "topicRef": { "type": ["string", "null"] }
      }
    },
    "grant": {
      "type": "object",
      "additionalProperties": false,
      "required": ["status", "authorizationGranted", "grantRef", "grantDigest"],
      "properties": {
        "status": { "type": "string", "enum": ["missing", "active", "expired", "revoked", "denied", "unknown"] },
        "authorizationGranted": { "type": "boolean" },
        "grantRef": { "type": ["string", "null"] },
        "grantDigest": { "type": ["string", "null"], "pattern": "^sha256:[a-f0-9]{64}$" },
        "reason": { "type": ["string", "null"] },
        "expiresAt": { "type": ["string", "null"] },
        "revocationRef": { "type": ["string", "null"] }
      }
    },
    "scope": {
      "type": "object",
      "additionalProperties": false,
      "required": ["allowed", "denied"],
      "properties": {
        "allowed": {
          "type": "object",
          "additionalProperties": false,
          "properties": {
            "providerIds": { "type": "array", "items": { "type": "string" }, "uniqueItems": true },
            "modelRefs": { "type": "array", "items": { "type": "string" }, "uniqueItems": true },
            "toolRefs": { "type": "array", "items": { "type": "string" }, "uniqueItems": true },
            "cacheScopeRefs": { "type": "array", "items": { "type": "string" }, "uniqueItems": true },
            "memoryScopeRefs": { "type": "array", "items": { "type": "string" }, "uniqueItems": true },
            "storageScopeRefs": { "type": "array", "items": { "type": "string" }, "uniqueItems": true },
            "evidenceScopeRefs": { "type": "array", "items": { "type": "string" }, "uniqueItems": true }
          }
        },
        "denied": {
          "type": "object",
          "additionalProperties": false,
          "properties": {
            "providerIds": { "type": "array", "items": { "type": "string" }, "uniqueItems": true },
            "modelRefs": { "type": "array", "items": { "type": "string" }, "uniqueItems": true },
            "toolRefs": { "type": "array", "items": { "type": "string" }, "uniqueItems": true },
            "cacheScopeRefs": { "type": "array", "items": { "type": "string" }, "uniqueItems": true },
            "memoryScopeRefs": { "type": "array", "items": { "type": "string" }, "uniqueItems": true },
            "storageScopeRefs": { "type": "array", "items": { "type": "string" }, "uniqueItems": true },
            "evidenceScopeRefs": { "type": "array", "items": { "type": "string" }, "uniqueItems": true }
          }
        }
      }
    },
    "receiptSafety": {
      "type": "object",
      "additionalProperties": false,
      "required": ["includeRawContent", "rawPromptContentIncluded", "rawKvCacheContentIncluded", "secretValuesIncluded", "privateMemoryIncluded"],
      "properties": {
        "includeRawContent": { "type": "boolean", "const": false },
        "rawPromptContentIncluded": { "type": "boolean", "const": false },
        "rawKvCacheContentIncluded": { "type": "boolean", "const": false },
        "secretValuesIncluded": { "type": "boolean", "const": false },
        "privateMemoryIncluded": { "type": "boolean", "const": false }
      }
    },
    "issuedAt": { "type": "string" },
    "labels": { "type": "object", "additionalProperties": { "type": "string" } }
  }
}
