{
  "specVersion": "0.1.0",
  "id": "urn:srcos:agent-machine:agent-registry-grant:active-loopback-activation",
  "kind": "AgentRegistryGrant",
  "request": {
    "requestId": "urn:srcos:agent-machine:grant-request:active-loopback-activation",
    "agentMachineId": "urn:srcos:agent-machine:m2-asahi-local",
    "agentPodId": "urn:srcos:agent-machine:agent-pod:local-podman-llama-cpp",
    "requestedAgentIdentityRef": "urn:srcos:agent:local-inference-provider",
    "sessionRef": "urn:srcos:session:local-bootstrap",
    "workroomRef": "urn:srcos:workroom:local-default",
    "topicRef": "urn:srcos:topic:agent-machine"
  },
  "grant": {
    "status": "active",
    "authorizationGranted": true,
    "grantRef": "urn:srcos:agent-registry-grant:active-loopback-activation",
    "grantDigest": "sha256:4444444444444444444444444444444444444444444444444444444444444444",
    "reason": "Loopback provider activation is active for the local inference provider with no memory or cache reuse scope.",
    "expiresAt": "2026-05-04T13:50:00Z",
    "revocationRef": "urn:srcos:revocation:active-loopback-activation"
  },
  "scope": {
    "allowed": {
      "providerIds": ["urn:srcos:agent-machine:inference-provider:asahi-llama-cpp"],
      "modelRefs": ["urn:srcos:model:local-gguf-default"],
      "toolRefs": ["urn:srcos:tool:start-provider", "urn:srcos:tool:mount-cache", "urn:srcos:tool:emit-runtime-receipt", "urn:srcos:tool:emit-storage-receipt"],
      "cacheScopeRefs": [],
      "memoryScopeRefs": [],
      "storageScopeRefs": ["urn:srcos:agent-machine:storage-receipt:local-lvm-warm-cache"],
      "evidenceScopeRefs": ["urn:srcos:evidence:deployment-receipts", "urn:srcos:evidence:runtime-receipts"]
    },
    "denied": {
      "providerIds": [],
      "modelRefs": [],
      "toolRefs": ["urn:srcos:tool:reuse-cache", "urn:srcos:tool:public-ingress"],
      "cacheScopeRefs": ["urn:srcos:policy-domain:local-workstation-default"],
      "memoryScopeRefs": ["urn:srcos:memory:local-default"],
      "storageScopeRefs": [],
      "evidenceScopeRefs": []
    }
  },
  "receiptSafety": {
    "includeRawContent": false,
    "rawPromptContentIncluded": false,
    "rawKvCacheContentIncluded": false,
    "secretValuesIncluded": false,
    "privateMemoryIncluded": false
  },
  "issuedAt": "2026-05-04T12:50:00Z",
  "labels": {
    "sourceos.registry.prototype": "true",
    "sourceos.registry.result": "active",
    "sourceos.activation.authorized": "true"
  }
}
